{
  "receipt_id": "LOCAL_GPU_SUPPORT_NODE-LLM-RUNTIME-RECEIPT-001",
  "receipt_type": "local_llm_runtime_receipt",
  "runtime_subject_id": "LOCAL_GPU_SUPPORT_NODE",
  "schema_claim_ceiling": "SCHEMA_ONLY_NOT_RUNTIME_PROOF",
  "model": {
    "provider": "local",
    "model_name": "example-model",
    "model_version": "example-version",
    "model_digest": "example-digest",
    "runtime_engine": "example-runtime"
  },
  "input": {
    "input_packet_ref": "sanitized-input-packet.json",
    "input_hash_sha256": "aaaaaaaaaaaaaaaaaaaaaaaaaaaaaaaaaaaaaaaaaaaaaaaaaaaaaaaaaaaaaaaa",
    "raw_input_included": false
  },
  "output": {
    "output_packet_ref": "sanitized-output-packet.json",
    "output_hash_sha256": "bbbbbbbbbbbbbbbbbbbbbbbbbbbbbbbbbbbbbbbbbbbbbbbbbbbbbbbbbbbbbbbb",
    "raw_output_included": false,
    "allowed_output_scope": [
      "summarize",
      "recommend_next_checks",
      "map_evidence",
      "list_uncertainty"
    ]
  },
  "runtime": {
    "runtime_status": "PRIVATE_EVIDENCE_ONLY",
    "runtime_active": false,
    "runtime_active_claim": "NOT_PROVEN",
    "signal_observed": false,
    "public_safe": false,
    "evidence_hash_sha256": "cccccccccccccccccccccccccccccccccccccccccccccccccccccccccccccccc"
  },
  "operator_review": {
    "operator_approval_required": true,
    "operator_approved": false,
    "approved_for_public_use": false
  },
  "ai_decided_disposition": false,
  "claim_boundary": {
    "schema_proves_runtime": false,
    "schema_proves_signal": false,
    "schema_proves_public_safe_status": false,
    "ai_final_disposition_authority": false
  },
  "privacy_boundary": {
    "raw_prompt_included": false,
    "raw_model_output_included": false,
    "local_paths_included": false,
    "hostnames_included": false,
    "internal_ips_included": false,
    "secrets_included": false
  },
  "created_at": "2026-05-02T00:00:00Z"
}
